,Tweet,Target,Stance,Opinion Towards,Sentiment,Tweet Id
207,"@Ljubica1 @NeilClark66 @CllrBSilvester Alors accepterez-vous toutes les lois qui nous sont imposées simplement parce qu'il est Premier ministre ?
Aussi stupide, inutile ou dangereux ?
Pensez-vous vraiment que le titre PM lui donne un pouvoir total sur nos mouvements ?
#notmypm #SansMasques",stay_at_home_orders,AGAINST,"1.  The tweet explicitly expresses opinion about the target, a part of the target, or an aspect of the target.",neg,1289556227546992648
208,"@nypost Qu'en est-il de l'alcool au volant ? Le smart #WuhanCoronavirus n'est pas contagieux autour des voitures. Le gouvernement a demandé #15DaysToStopTheSpread, qui entre dans son quatrième mois. Le gouvernement a eu sept mois pour isoler cette chose. #Échouer #Réouvrirl'Amérique",stay_at_home_orders,AGAINST,"1.  The tweet explicitly expresses opinion about the target, a part of the target, or an aspect of the target.",neg,1278230201038708736
209,@DanielAndrewsMP Vous êtes un psychopathe. Dire aux Victoriens de ne pas embrasser leur mère. Malade. #resigndanandrews #resigndanielandrews #nomasks,stay_at_home_orders,AGAINST,"1.  The tweet explicitly expresses opinion about the target, a part of the target, or an aspect of the target.",neg,1288655679612305410
210,@SABreakingNews Le verrouillage était inconstitutionnel au départ.,stay_at_home_orders,AGAINST,"1.  The tweet explicitly expresses opinion about the target, a part of the target, or an aspect of the target.",neg,1277601066989821956
211,"@thehill Pourquoi #FakeNews continue-t-il de signaler le nombre de cas sans mentionner combien d'entre eux étaient malades et symptomatiques

Qui se soucie si le virus se propage si personne ne tombe malade
#CorvidImmunité ?",stay_at_home_orders,AGAINST,2. The tweet does NOT expresses opinion about the target but it HAS opinion about something or someone other than the target.,neg,1288024688371748864
212,"@LordBrexit Le gouvernement. est fou.
Ignorez tout ce qu'ils disent et font et reprenez une vie normale.
Pour ma part, je ne resterai pas dans n'importe quel gouvernement. disent les idiots.
Je suis tombé pendant un mois du dernier confinement, plus jamais ma vie ne sera gouvernée par ces criminels.
#NoMaskOnMe",stay_at_home_orders,AGAINST,"1.  The tweet explicitly expresses opinion about the target, a part of the target, or an aspect of the target.",neg,1289976998446510080
213,"@PressSec @GreatAmericaPAC @realDonaldTrump Veuillez tout ouvrir ! Cela devient ridicule, nous voulons travailler et l'immunité collective peut arriver, nous devons arrêter de vivre dans la PEUR et d'être dictés par les médias corrompus et les gens qui abusent de leur pouvoir",stay_at_home_orders,AGAINST,"1.  The tweet explicitly expresses opinion about the target, a part of the target, or an aspect of the target.",neg,1283124547558928385
214,"@henrymcmaster Permettez-moi de préciser que ce virus n'est pas aussi grave que vous, les politiciens, le prétendez !!!! Arrête d'essayer d'être un nazi",stay_at_home_orders,AGAINST,2. The tweet does NOT expresses opinion about the target but it HAS opinion about something or someone other than the target.,neg,1278469645197025280
215,Tout fonctionnaire du gouvernement forçant les entreprises à fermer et à libre circulation des personnes devrait être poursuivi et tenu responsable d'avoir annulé le 1er amendement et tout agent qui a arrêté quelqu'un devrait également être inculpé. #coronavirus #1stAmendment,stay_at_home_orders,AGAINST,"1.  The tweet explicitly expresses opinion about the target, a part of the target, or an aspect of the target.",neg,1281729417539194886
216,"La BBC ne peut pas contenir son excitation

la joie est écrite sur leurs visages aux nouvelles ce soir annonçant des verrouillages régionaux

tant de PEUR pour qu'ils se propagent

#nomasks

#COVID 19",stay_at_home_orders,AGAINST,"1.  The tweet explicitly expresses opinion about the target, a part of the target, or an aspect of the target.",neg,1288944676473626625
217,@rwillingham @georgiecrozier Le navire de l'élimination a navigué en mars. L'occasion a été perdue. Des verrouillages plus sévères ne sont ni viables ni inutiles. Détruire l'économie et la santé mentale. Nous devons nous adapter pour continuer notre vie normale avec le virus.,stay_at_home_orders,AGAINST,"1.  The tweet explicitly expresses opinion about the target, a part of the target, or an aspect of the target.",other,1289495908657139713
218,@ RoseDC11 @ meldu5 Trump doit se débarrasser de Fauci,stay_at_home_orders,AGAINST,2. The tweet does NOT expresses opinion about the target but it HAS opinion about something or someone other than the target.,neg,1286838305640845318
219,@ charliekirk11 Nous ne tombons pas deux fois dans le panneau ! :no_entry_sign: #stayopen,stay_at_home_orders,AGAINST,"1.  The tweet explicitly expresses opinion about the target, a part of the target, or an aspect of the target.",neg,1276231976526233601
220,"@DianneInIndiana @no_silenced Il donne à chaque Californien le ""grand"" en ce moment en forçant UN AUTRE arrêt, comme le premier a si bien fonctionné. #folie",stay_at_home_orders,AGAINST,"1.  The tweet explicitly expresses opinion about the target, a part of the target, or an aspect of the target.",neg,1282803589342101504
221,Le travail à domicile est tellement frustrant... Premier jour à la maison après 7 jours de #confinement à Raipur..Encore 6 jours à faire. Mes sympathies :mask: :grimacing:,stay_at_home_orders,AGAINST,"1.  The tweet explicitly expresses opinion about the target, a part of the target, or an aspect of the target.",neg,1285965897274781697
222,"@TheLucDevine Si quoi que ce soit, il a réagi de manière excessive,

Le virus est vivant mais est beaucoup moins dangereux et vous ne pouvez pas le combattre,

Vivre et laisser vivre

#endlockdown",stay_at_home_orders,AGAINST,"1.  The tweet explicitly expresses opinion about the target, a part of the target, or an aspect of the target.",neg,1290189949757612033
223,"@DanielAndrewsMP Pour que les entreprises continuent de fonctionner, ignorez le virus et",stay_at_home_orders,AGAINST,"1.  The tweet explicitly expresses opinion about the target, a part of the target, or an aspect of the target.",other,1286506276789223424
224,"@latimes Dark to Light, les gens se réveillent enfin, ne disant pas que c'était un canular, disant simplement que cela a été tellement démesuré. TROP C'EST TROP, fini les confinements, fini les mensonges sur les chiffres, fini les mandats de masques etc...",stay_at_home_orders,AGAINST,"1.  The tweet explicitly expresses opinion about the target, a part of the target, or an aspect of the target.",neg,1286087030376628230
225,@harrisongolden @LouisianaGov @BRProudNews L'enseignement à domicile est une option pour tous ceux qui ont peur d'envoyer leurs enfants à l'école ! Regardez les données et faites preuve de bon sens ! #juste dire #OpenSchools,stay_at_home_orders,AGAINST,2. The tweet does NOT expresses opinion about the target but it HAS opinion about something or someone other than the target.,pos,1283157475961823232
226,"@Richzeoli @DawnMendte C'est la plus grande #Scamdemic de l'histoire américaine !
Il nous faut du #Hcq et du #Zinc à faible dose pour ceux qui le souhaitent !
#ReOpenSchools",stay_at_home_orders,AGAINST,2. The tweet does NOT expresses opinion about the target but it HAS opinion about something or someone other than the target.,neg,1282643644164583424
227,"Barres ouvertes ! Sport ouvert ! Ouvrez les écoles ! Je suis enseignant au secondaire et nous pourrions parler d'ouverture d'écoles si nous avons mis en place certaines de ces mesures. Mais puisque nous ne pouvons pas / ne pouvons pas / ne voulons pas, je crois que mes étudiants et collègues sont",stay_at_home_orders,AGAINST,"1.  The tweet explicitly expresses opinion about the target, a part of the target, or an aspect of the target.",other,1277805067232522241
228,"@jsolomonReports C'est une BOMBE !!! Le CDC indique qu'environ 20 MILLIONS d'Américains ont eu le virus, la plupart sans aucun symptôme. Cela abaisse le taux de mortalité à 0,62% L'OMS a déclaré que le taux de mortalité était de 3,4%. C'est une énorme différence et pourquoi il est sûr de",stay_at_home_orders,AGAINST,2. The tweet does NOT expresses opinion about the target but it HAS opinion about something or someone other than the target.,neg,1276487825135996928
229,@drdavidsamadi Apprenez à vivre avec et passez à autre chose... nous devons revenir à la normale,stay_at_home_orders,AGAINST,"1.  The tweet explicitly expresses opinion about the target, a part of the target, or an aspect of the target.",neg,1287117324529483776
230,Une arme à feu est plus efficace pour garder une distance sociale qu'un chiffon (humide) couvrant votre visage #2A #MondayMotivation,stay_at_home_orders,AGAINST,2. The tweet does NOT expresses opinion about the target but it HAS opinion about something or someone other than the target.,neg,1287775119721541632
231,"@SpeakerPelosi @FaceTheNation Votre facture est l'aide sociale ne se produira pas, il est temps de retourner au travail",stay_at_home_orders,AGAINST,"1.  The tweet explicitly expresses opinion about the target, a part of the target, or an aspect of the target.",neg,1287561497871351809
232,@gayewrosser @GovAbbott @NASA_Johnson Je serais intéressé par combien d'argent vous gagnez en restant à la maison.,stay_at_home_orders,AGAINST,"1.  The tweet explicitly expresses opinion about the target, a part of the target, or an aspect of the target.",neg,1286203856012161026
233,"@SecretaryCarson @HighlandsAL Parce que c'est ce que font les églises ! :latin_cross::thumbs_up_medium-dark_skin_tone::thumbsup::thumbs_up_light_skin_tone :

Merci, Dr Carson. C'est inspirant à une époque où tant de gens sont paralysés par la peur. Plus il y a de tests de coronavirus, mieux c'est. Cela nous rapproche d'autant plus d'une reconstruction encore plus forte !

#AmericaWorksTogether #KAG",stay_at_home_orders,AGAINST,2. The tweet does NOT expresses opinion about the target but it HAS opinion about something or someone other than the target.,pos,1249798247687782400
234,"@IngrahamAngle Again - un autre mensonge avec des numéros de #coronavirus ! Quand les gens vont-ils se réveiller ?

#OpenSchools",stay_at_home_orders,AGAINST,2. The tweet does NOT expresses opinion about the target but it HAS opinion about something or someone other than the target.,neg,1284827343429804033
235,Le #confinement tue des gens !,stay_at_home_orders,AGAINST,"1.  The tweet explicitly expresses opinion about the target, a part of the target, or an aspect of the target.",neg,1285762580330536960
236,@CAgovernor SUIVEZ LES RÉCUPÉRATIONS POUR QUE VOS ABONNÉS COMPRENNENT TOUTE L'HISTOIRE. RÉVEILLEZ-VOUS LES GENS OU LA GRANDE DÉPRESSION ARRIVE BIENTÔT. PENSEZ-VOUS QUE LE GOUVERNEMENT VA NOUS PAYER POUR RESTER À LA MAISON. :joy::joy::rolling_on_the_floor_laughing: j'espère que tu aimes être fauché et affamé.,stay_at_home_orders,AGAINST,"1.  The tweet explicitly expresses opinion about the target, a part of the target, or an aspect of the target.",neg,1282500304336908289
237,@TeamCavuto @FoxNews Vissez-vous et vos experts en droit. @realDonaldTrump lors d'une urgence nationale peut rédiger un décret ordonnant au gouvernement local de s'ouvrir. La raison en est que la simple loi fédérale est suprême sur les lois des États #COVID19 #FireFauci #ReopenNC,stay_at_home_orders,AGAINST,"1.  The tweet explicitly expresses opinion about the target, a part of the target, or an aspect of the target.",neg,1249803304021958658
238,@SharnelleVella L'histoire selon laquelle le covid-19 est un virus d'une dangerosité sans précédent nécessitant des mesures sans précédent est un mensonge.,stay_at_home_orders,AGAINST,2. The tweet does NOT expresses opinion about the target but it HAS opinion about something or someone other than the target.,neg,1286503365413728259
239,"@TexasTribune Donc, en gros, être enfermé semble ne rien faire de toute façon !",stay_at_home_orders,AGAINST,"1.  The tweet explicitly expresses opinion about the target, a part of the target, or an aspect of the target.",neg,1282434318925799426
240,"@EndUKLockdown1 Exactement, les inévitables nouveaux ""cas"" qui sont révélés seront utilisés contre nous pour verrouiller encore plus de villes et supprimer encore plus de nos droits. S'IL VOUS PLAÎT les gens, RÉVEILLEZ-VOUS ! @DailyMailUK",stay_at_home_orders,AGAINST,"1.  The tweet explicitly expresses opinion about the target, a part of the target, or an aspect of the target.",neg,1289122607141445633
241,"@IngrahamAngle Plus de projets de loi de relance ne rouvrent l'Amérique, laissez les gens retourner au travail.",stay_at_home_orders,AGAINST,"1.  The tweet explicitly expresses opinion about the target, a part of the target, or an aspect of the target.",neg,1286623305261342720
242,"#ImVoting4BidenParce que je ne vote pas pour Biden. Ne pas voter pour Trump. Ne pas voter pour QUICONQUE veut prolonger le confinement, nous obliger à porter des masques, nous obliger à nous faire vacciner, nous suivre, nous pucer... vous voyez l'idée. Trop c'est trop. #NoNewNormal",stay_at_home_orders,AGAINST,"1.  The tweet explicitly expresses opinion about the target, a part of the target, or an aspect of the target.",neg,1286402187787227137
243,"Amérique!....

Les trolls et articles propagandistes sont à un tout nouveau niveau de folie. J'AI DIT que cela arriverait avant les élections. Ces gens détruiraient l'Amérique pour obtenir ce qu'ils veulent.

Allons-nous danser... ou allons-nous nous BATTRE ?

#COVID 19",stay_at_home_orders,AGAINST,2. The tweet does NOT expresses opinion about the target but it HAS opinion about something or someone other than the target.,neg,1283522361069907968
244,@KyleKashuv C'est complètement scandaleux. Assez de ces dictateurs tyranniques démocrates.,stay_at_home_orders,AGAINST,2. The tweet does NOT expresses opinion about the target but it HAS opinion about something or someone other than the target.,neg,1286782349972250626
245,"Portez un masque dans un magasin, mais ne vous embêtez pas si vous voulez manifester ou faire la fête en masse dans une rue. Notre «État» vient de mettre un autre couteau dans notre secteur de la vente au détail fragile / mourant et leurs incohérences tuent notre économie #COVID19 #confusion #killingoureconomy",stay_at_home_orders,AGAINST,"1.  The tweet explicitly expresses opinion about the target, a part of the target, or an aspect of the target.",neg,1283360639923167232
246,"#Politiquement incorrect
Les masques sont pour le spectacle. Le virus passe à travers ! #MAGA #Trump2020 :drapeau pour les États-Unis ::masque ::personne facepalming:",stay_at_home_orders,AGAINST,2. The tweet does NOT expresses opinion about the target but it HAS opinion about something or someone other than the target.,neg,1287483393706545154
247,@SRCC Arrêtez de permettre aux gouvernements des États de garder la plupart des entreprises fermées.,stay_at_home_orders,AGAINST,"1.  The tweet explicitly expresses opinion about the target, a part of the target, or an aspect of the target.",neg,1285925321779359744
248,"@RonDeSantisFL T'es pas très malin hein ? Vous avez politisé le coronavirus au détriment des vies américaines. Vous fermez à nouveau les entreprises, n'est-ce pas ? Vous n'êtes pas très intelligent. Un mot est suffisant pour le sage.
#corona virus",stay_at_home_orders,AGAINST,"1.  The tweet explicitly expresses opinion about the target, a part of the target, or an aspect of the target.",neg,1276894201058385920
249,@JayInslee a laissé ces enfants retourner au travail. Ils s'ennuient visiblement beaucoup. #seattleprotests,stay_at_home_orders,AGAINST,"1.  The tweet explicitly expresses opinion about the target, a part of the target, or an aspect of the target.",other,1287356703466377217
250,"CINQ gouverneurs démocrates sont en train de détruire l'industrie du transport aérien !

Les restrictions draconiennes sur les voyages aériens entre 25 États provoquent des milliers de licenciements.

OUVREZ L'AMÉRIQUE MAINTENANT !
@TheJusticeDept
@realDonaldTrump
@DonaldJTrumpJr
@FAANews
@GouvMurphy",stay_at_home_orders,AGAINST,"1.  The tweet explicitly expresses opinion about the target, a part of the target, or an aspect of the target.",neg,1283511097031561218
251,Combien d'#Américains auraient accepté de #fermer si nous avions su que ce serait pendant plus de 4 mois ! ? Les règles de #Californie concernant #COVID19 #lockdown sont complètement ridicules. De nombreuses entreprises familiales et #Restaurants d'entreprise déposeront une #faillite en raison d'un fardeau de conformité prolongé.,stay_at_home_orders,AGAINST,"1.  The tweet explicitly expresses opinion about the target, a part of the target, or an aspect of the target.",neg,1281813470673924097
252,#walgreens #BedBathandBeyond tous prévus pour les fermetures de magasins. Je savais que de nombreuses entreprises ne survivraient pas à ces fermetures de virus.,stay_at_home_orders,AGAINST,2. The tweet does NOT expresses opinion about the target but it HAS opinion about something or someone other than the target.,neg,1281382425541533696
253,La vérité brutale est que ne rien faire et laisser le virus faire son pire aurait été infiniment préférable à la misère et à la dévastation causées par les actions insensées du gouvernement. #COVID19 #COVID__19 #COVIDIOTS #Covid_19,stay_at_home_orders,AGAINST,2. The tweet does NOT expresses opinion about the target but it HAS opinion about something or someone other than the target.,neg,1283804237672194049
254,"Quelqu'un, s'il vous plaît, me rappelle pourquoi un virus avec un taux de survie de plus de 90 % provoque toujours des blocages ? #COVID-19 [feminine",stay_at_home_orders,AGAINST,2. The tweet does NOT expresses opinion about the target but it HAS opinion about something or someone other than the target.,neg,1290498442624503810
255,"@IngrahamAngle @IngrahamAngle c'est ce que mes parents m'ont appris. Finalement, nous serons tous exposés, comme nous le sommes à la grippe et à d'autres germes. Pourtant, seulement 40 % d'entre nous se font même vacciner contre la grippe. Je vois encore des gens en public ne pas se laver les mains !",stay_at_home_orders,AGAINST,2. The tweet does NOT expresses opinion about the target but it HAS opinion about something or someone other than the target.,neg,1285927035043557377
256,@ KaceyonFox7 @ 2LarryJohnson7 Mettons au défi tous les propriétaires d'entreprise de notre beau pays d'ouvrir leur entreprise le jour de l'indépendance. Quelle meilleure façon de célébrer notre LIBERTÉ ! RT #IndependenceDay #Liberté,stay_at_home_orders,AGAINST,"1.  The tweet explicitly expresses opinion about the target, a part of the target, or an aspect of the target.",pos,1278082062986080257
257,"La courbe s'aplatit

Imaginez si Warren et le département de la santé n'avaient pas dit que ce n'était pas grave - sautez dans le train - célébrez le nouvel an chinois, etc.

Imaginez si vous n'aviez pas mis une éternité à prendre une décision

Les supermarchés ont été ouverts - il est temps de rouvrir #NY

#corona virus",stay_at_home_orders,AGAINST,"1.  The tweet explicitly expresses opinion about the target, a part of the target, or an aspect of the target.",neg,1248357251276066816
258,@MattHancock @andrealeadsom Non merci. #novaccine #nomasks #endsocialdistancing,stay_at_home_orders,AGAINST,2. The tweet does NOT expresses opinion about the target but it HAS opinion about something or someone other than the target.,neg,1284411295358476290
259,Je déteste le fait que je ne peux pas sortir ma fille et vivre une enfance normale :broken_heart: Espérons que COVID s'en aille !,stay_at_home_orders,AGAINST,"1.  The tweet explicitly expresses opinion about the target, a part of the target, or an aspect of the target.",other,1281301178412707841
260,"Faites savoir aux gouverneurs de @realDonaldTrump @SpeakerPelosi @senatemajldr et aux dirigeants locaux qu'ils travaillent pour nous, #WeThePeople ils ont eu tout le temps de prendre le contrôle de son attaque terroriste ! #COVID19 #coronavirus Nous allons rouvrir l'Amérique à toute vitesse",stay_at_home_orders,AGAINST,"1.  The tweet explicitly expresses opinion about the target, a part of the target, or an aspect of the target.",neg,1249496334345920512
261,@JosephJFlynn1 Absolument. Je suis sûr que quelqu'un qui fait ce genre de choses peut revenir en arrière et compter combien de fois @realDonaldTrump a soulevé cela et combien de fois Fauci l'a rejeté et combien d'histoires cinglantes MSM avait à ce sujet. @IngrahamAngle était au-dessus de cela depuis le début.,stay_at_home_orders,AGAINST,2. The tweet does NOT expresses opinion about the target but it HAS opinion about something or someone other than the target.,other,1287901641853636608
262,"450 000 personnes meurent chaque année aux États-Unis seulement à cause de la consommation de cigarettes. Où est le grand gouvernement ? Pourquoi ai-je le droit de fumer, mais pas le droit de gérer pleinement une entreprise ? Enlevez les menottes. @GovMikeDeWine
@realDonaldTrump",stay_at_home_orders,AGAINST,"1.  The tweet explicitly expresses opinion about the target, a part of the target, or an aspect of the target.",neg,1278561492485525504
263,"@AlanLevinovitz Gotcha. Les ceintures de sécurité sauvent vraiment des vies. Masques... probablement pas. Peut-être qu'ils le font, mais j'en doute.",stay_at_home_orders,AGAINST,2. The tweet does NOT expresses opinion about the target but it HAS opinion about something or someone other than the target.,other,1282298453851361281
264,Où était l'opposition au port du masque dans @BBCNewsnight ? Un lord conservateur et un député travailliste soutiennent tous deux encore plus de restrictions à notre liberté au nom de la sécurité publique,stay_at_home_orders,AGAINST,2. The tweet does NOT expresses opinion about the target but it HAS opinion about something or someone other than the target.,neg,1282798485839007744
265,"@MattHancock @NHSX S'il vous plaît, arrêtez de gaspiller plus de notre argent. Le verrouillage aurait dû être levé dès que le NHS avait la capacité, au lieu de cela, des milliers de personnes ont manqué des références et des traitements urgents pour le cancer et d'autres maladies.",stay_at_home_orders,AGAINST,"1.  The tweet explicitly expresses opinion about the target, a part of the target, or an aspect of the target.",neg,1283700744789663744
266,@d_mos77 @SteveBakerHW @tradegovuk @trussliz @Tussell_UK Je pense que la « diligence raisonnable de base » a quitté la pièce il y a longtemps avant qu'elle ne puisse être appliquée au modèle de virus impérial qui a été utilisé pour emprisonner tout le pays !,stay_at_home_orders,AGAINST,"1.  The tweet explicitly expresses opinion about the target, a part of the target, or an aspect of the target.",neg,1277769527732961280
267,"@ShawnShafai @nsarwark @chrismartenson Donc
Fermeture des écoles
Distanciation sociale
Masques
Plexiglas au Grover
Verrouiller les affaires
Restez à la maison restez en sécurité

N'a pas fonctionné",stay_at_home_orders,AGAINST,"1.  The tweet explicitly expresses opinion about the target, a part of the target, or an aspect of the target.",neg,1276600767860953088
268,"Il y a normalement environ 280 000 décès par an au Canada.
Parmi ceux-ci, environ 8 000 sont généralement atteints de grippe / pneumonie.
À ce jour, 8773 personnes sont décédées de ou ""avec"" Covid-19.
Combien sont morts de la grippe ""normale"" ?
Combien de EXTRA mourront par manque de soins/diagnostic dû au confinement ?",stay_at_home_orders,AGAINST,"1.  The tweet explicitly expresses opinion about the target, a part of the target, or an aspect of the target.",neg,1282049357416738817
269,"... ne peut pas se différencier du virus vivant réel, donc le test est défectueux, mais Inslee utilise ces données pour conserver ses pouvoirs d'urgence afin de maintenir notre État fermé. Veuillez aller en ligne et voir les données par vous-même. #S'unir #Combattre #Voter",stay_at_home_orders,AGAINST,"1.  The tweet explicitly expresses opinion about the target, a part of the target, or an aspect of the target.",neg,1286740197468549120
270,"@AlexMarlow @BreitbartNews Idiots.. Réveillez-vous l'Amérique maintenant, les communistes essaient de prendre le contrôle de notre pays.",stay_at_home_orders,AGAINST,2. The tweet does NOT expresses opinion about the target but it HAS opinion about something or someone other than the target.,neg,1275964185654947841
271,"Dans mon pays, nous avons des gangs vraiment déficients mentaux connus sous le nom de démocrates et de républicains. Les responsables de chaque gang dictent tout aux autres. La plupart des autres n'ont aucune idée de quoi que ce soit et suivent.

#fauxvirus
#coronavirushoax
#covidiots",stay_at_home_orders,AGAINST,2. The tweet does NOT expresses opinion about the target but it HAS opinion about something or someone other than the target.,neg,1276193434047414272
272,"Ce n'est pas le droit du gouvernement de dire à un grand-parent s'il peut ou non embrasser ses petits-enfants

#tyrannie #totalitarisme",stay_at_home_orders,AGAINST,"1.  The tweet explicitly expresses opinion about the target, a part of the target, or an aspect of the target.",neg,1289725579571261441
273,"@AlexBerenson @MarcDamon1 Ouais parce que le premier verrouillage l'a vraiment résolu, non ?!? Ces gens sont juste fous !",stay_at_home_orders,AGAINST,"1.  The tweet explicitly expresses opinion about the target, a part of the target, or an aspect of the target.",neg,1287734729802842113
